{
  "id": 34,
  "status": "ready_for_codex",
  "cluster": "ИИ для бизнеса",
  "title": "ИИ для производства: сценарии, внедрение и окупаемость",
  "primaryKeyword": "ИИ для производства",
  "supportingKeywords": [
    "ИИ в производстве",
    "искусственный интеллект в производстве",
    "внедрение ИИ в производство",
    "компьютерное зрение на производстве",
    "ИИ для контроля качества",
    "предиктивное обслуживание оборудования"
  ],
  "intent": "practical",
  "audience": [
    "собственник производства",
    "COO",
    "директор производства",
    "руководитель качества",
    "технический директор"
  ],
  "targetSlug": "ii-dlya-proizvodstva-scenarii-vnedrenie",
  "priority": "high",
  "cta": "production_ai_audit",
  "notes": "P0 services SEO. Редакционный пакет готов, публикация ждёт 4 PNG в raw-images и npm run images:prep. Не обзор трендов, а диагностическая статья для директора: где ИИ окупается на производстве, какие данные нужны, какой первый пилот выбрать, как считать эффект по браку, простоям и ручной проверке."
}
