{
  "id": 34,
  "status": "published",
  "cluster": "Доступ к ИИ из России",
  "title": "Локальные нейросети 2026: как запустить ИИ на своём компьютере",
  "primaryKeyword": "локальная нейросеть",
  "supportingKeywords": [
    "нейросеть на компьютере",
    "запустить llm локально",
    "локальные нейросети на пк",
    "нейросеть без интернета",
    "ollama на русском"
  ],
  "intent": "practical",
  "audience": [
    "разработчик",
    "предприниматель",
    "технический специалист",
    "энтузиаст"
  ],
  "targetSlug": "lokalnye-nejroseti-kak-zapustit-ii-na-svoem-kompyutere",
  "priority": "high",
  "cta": "telegram_digest",
  "notes": "Вордстат 2026-06-11: кластер 6 217 показов/мес + «запустить llm локально» 151 + «сервер для нейросети» 900. Шорт-лист money-гайдов B6 п.4. Покрыть: Ollama/LM Studio, выбор модели, требования к железу, worked example «потянет ли мой ПК», 152-ФЗ как аргумент. Мостик на аренду GPU (974) — реф-потенциал позже."
}
