{
  "id": 3,
  "status": "published",
  "cluster": "ИИ для бизнеса",
  "title": "ИИ для малого бизнеса: с чего начать",
  "primaryKeyword": "ИИ для малого бизнеса",
  "supportingKeywords": [
    "нейросети для малого бизнеса",
    "как использовать ИИ в малом бизнесе",
    "ИИ инструменты для малого бизнеса",
    "автоматизация малого бизнеса с ИИ"
  ],
  "intent": "practical",
  "audience": [
    "предприниматель",
    "владелец малого бизнеса",
    "руководитель отдела",
    "маркетолог"
  ],
  "targetSlug": "ii-dlya-malogo-biznesa-s-chego-nachat",
  "priority": "high",
  "cta": "ai_project_checklist",
  "notes": "Сфокусироваться на недорогих сценариях без тяжёлой разработки: продажи, поддержка, маркетинг, документы."
}
