{
  "id": 10,
  "status": "published",
  "cluster": "ИИ-агенты",
  "title": "ИИ-агенты в поддержке клиентов",
  "primaryKeyword": "ИИ агенты в поддержке клиентов",
  "supportingKeywords": [
    "AI агент для поддержки",
    "ИИ бот поддержки клиентов",
    "автоматизация поддержки с ИИ",
    "чат бот поддержки на базе ИИ"
  ],
  "intent": "practical",
  "audience": [
    "руководитель поддержки",
    "COO",
    "продакт",
    "предприниматель"
  ],
  "targetSlug": "ii-agenty-v-podderzhke-klientov",
  "priority": "high",
  "cta": "support_ai_audit",
  "notes": "Закрыть базу знаний, эскалации, качество ответов, CSAT, логи, безопасность и границы автоматизации."
}
