{
  "id": 6,
  "status": "published",
  "cluster": "ИИ для бизнеса",
  "title": "Как выбрать первый ИИ-проект в бизнесе",
  "primaryKeyword": "как выбрать первый ИИ проект",
  "supportingKeywords": [
    "первый AI проект в компании",
    "выбор проекта для внедрения ИИ",
    "матрица выбора AI проекта",
    "с чего начать AI автоматизацию"
  ],
  "intent": "practical",
  "audience": [
    "предприниматель",
    "CEO",
    "COO",
    "продакт",
    "руководитель отдела"
  ],
  "targetSlug": "kak-vybrat-pervyj-ii-proekt-v-biznese",
  "priority": "high",
  "cta": "ai_project_checklist",
  "notes": "Углубление в выбор первого проекта: 7 критериев со взвешенным скорингом (макс 100), скоринговая таблица 12 кандидатов, кейс дистрибьютора, worked example скоринга для отзывов на маркетплейсах."
}
