{
  "id": 4,
  "status": "ready_for_codex",
  "cluster": "ИИ для бизнеса",
  "title": "Какие бизнес-процессы автоматизировать с помощью ИИ",
  "primaryKeyword": "какие процессы автоматизировать с помощью ИИ",
  "supportingKeywords": [
    "автоматизация бизнес процессов ИИ",
    "AI автоматизация процессов",
    "процессы для внедрения ИИ",
    "нейросети для автоматизации бизнеса"
  ],
  "intent": "practical",
  "audience": [
    "CEO",
    "COO",
    "операционный директор",
    "руководитель отдела",
    "бизнес-аналитик"
  ],
  "targetSlug": "kakie-biznes-processy-avtomatizirovat-s-pomoshyu-ii",
  "priority": "high",
  "cta": "process_automation_audit",
  "notes": "Матрица процессов по эффекту, сложности, риску и данным. 10 рабочих сценариев, кейс агентства (Редакционный пример), worked example по поддержке интернет-магазина, counter-strategy 7 критериев."
}
